{
  "book_features": {
    "book_quality": {
      "book_health_score": "100",
      "consequence": "NONE",
      "health_status": "HEALTHY",
      "integrity_checksum": "35b9941782811766762eea067fea53f7c026fbe9ea8699f911c34d648b409d2a",
      "schema_version": "lot41-book-quality-binding-v1",
      "sequence_id": 1003,
      "veto_checksum": "000613129dbce4bfa189f66a9927c442a557556870381de92aa2b8da8a7951fc"
    },
    "cumulative_depth": {
      "asks": [
        {
          "cumulative_quantity": "0.65",
          "distance_bps": "0.01999000499750124937531234383",
          "price": "50025.1",
          "quantity": "0.65"
        },
        {
          "cumulative_quantity": "1.75",
          "distance_bps": "0.03998000999500249875062468766",
          "price": "50025.2",
          "quantity": "1.1"
        },
        {
          "cumulative_quantity": "2.15",
          "distance_bps": "0.05997001499250374812593703148",
          "price": "50025.3",
          "quantity": "0.4"
        }
      ],
      "bids": [
        {
          "cumulative_quantity": "0.9",
          "distance_bps": "0.01999000499750124937531234383",
          "price": "50024.9",
          "quantity": "0.9"
        },
        {
          "cumulative_quantity": "1.4",
          "distance_bps": "0.05997001499250374812593703148",
          "price": "50024.7",
          "quantity": "0.5"
        }
      ]
    },
    "decision_time": "2026-08-06T19:18:40.100000Z",
    "depth_bands": [
      {
        "ask_levels_observed": 1,
        "ask_quantity": "0.65",
        "band_bps": "0.025",
        "bid_levels_observed": 1,
        "bid_quantity": "0.9",
        "coverage_status": "OBSERVED_LEVELS_ONLY",
        "imbalance": "0.1612903225806451612903225806",
        "imbalance_status": "DEFINED",
        "schema_version": "lot41-depth-band-v1"
      },
      {
        "ask_levels_observed": 2,
        "ask_quantity": "1.75",
        "band_bps": "0.05",
        "bid_levels_observed": 1,
        "bid_quantity": "0.9",
        "coverage_status": "OBSERVED_LEVELS_ONLY",
        "imbalance": "-0.3207547169811320754716981132",
        "imbalance_status": "DEFINED",
        "schema_version": "lot41-depth-band-v1"
      },
      {
        "ask_levels_observed": 3,
        "ask_quantity": "2.15",
        "band_bps": "0.1",
        "bid_levels_observed": 2,
        "bid_quantity": "1.4",
        "coverage_status": "OBSERVED_LEVELS_ONLY",
        "imbalance": "-0.2112676056338028169014084507",
        "imbalance_status": "DEFINED",
        "schema_version": "lot41-depth-band-v1"
      }
    ],
    "event_time": "2026-08-06T19:18:40.065000Z",
    "extrapolated": false,
    "feature_checksum": "77a6f6b92cae8094292bb8a8b553c57a52e4c73d376251c9e55e8221d2376ab5",
    "horizon": "BOOK_SNAPSHOT",
    "instrument_id": "BTC-EUR-SPOT",
    "market_type": "SPOT",
    "microprice": "50025.01612903225806451612903",
    "mid_price": "50025",
    "observed_depth_only": true,
    "reason_codes": [
      "LOT41_SPREAD_DEPTH_IMBALANCE_COMPUTED",
      "LOT41_OBSERVED_DEPTH_ONLY",
      "LOT42_REMAINS_LOCKED"
    ],
    "receive_time": "2026-08-06T19:18:40.070000Z",
    "schema_version": "book-feature-state-v1",
    "sequence_id": 1003,
    "source_id": "kraken-reference-offline-fixture",
    "spread_absolute": "0.2",
    "spread_bps": "0.03998000999500249875062468766",
    "top_of_book": {
      "best_ask_price": "50025.1",
      "best_ask_quantity": "0.65",
      "best_bid_price": "50024.9",
      "best_bid_quantity": "0.9",
      "schema_version": "lot41-top-of-book-v1"
    },
    "venue": "KRAKEN"
  },
  "decision_time": "2026-08-06T19:18:40.100000Z",
  "event_time": "2026-08-06T19:18:40.065000Z",
  "generated_at": "2026-08-06T19:18:40.100000Z",
  "lineage": {
    "available_at": "2026-08-06T19:18:40.070000Z",
    "config_checksum": "c061aef52a789cc9b0b971fe01d0445d1a70f3664897e54539f5e1021628f8f0",
    "entry_gate_checksum": "1d3fab39fde8c92ed7c94af1b722b5f877d56663f28f856b603de7f3e31a8efe",
    "lineage_id": "lot41-reference-lineage-v1",
    "lot40_audit_checksum": "978e910d326e6895b652e256f980bc33203092157334ebe3824ebbf31da1632c",
    "lot40_integrity_checksum": "35b9941782811766762eea067fea53f7c026fbe9ea8699f911c34d648b409d2a",
    "lot40_state_checksum": "e601f60e8fad70c4c445955dda503a3b728614936ca17c964cb2ed9c8a927477",
    "lot40_veto_checksum": "000613129dbce4bfa189f66a9927c442a557556870381de92aa2b8da8a7951fc",
    "reconstructed_book_checksum": "a503d56b312cbb21586712fcf929a0381cbc9adde9c5d70700e1f7166ef58dde",
    "schema_version": "lot41-lineage-envelope-v1"
  },
  "metrics": {
    "latency_measurement_status": "NOT_MEASURED_OFFLINE_DETERMINISTIC_REPLAY",
    "lot_41_ask_levels_observed": 3,
    "lot_41_bid_levels_observed": 2,
    "lot_41_depth_bands_total": 3,
    "lot_41_processing_latency_us": null,
    "lot_41_records_processed_total": 1,
    "lot_41_undefined_imbalance_total": 0,
    "lot_41_validation_failures_total": 0,
    "schema_version": "lot41-metrics-v1"
  },
  "output_checksum": "23bc1713999aa6dd4d52edefe0b024860636f6f07864c4f8c97b4e91d47ba573",
  "reason_codes": [
    "LOT41_OFFLINE_FEATURES_VALIDATED",
    "LOT41_BOOK_QUALITY_BOUND",
    "LOT42_REMAINS_LOCKED"
  ],
  "receive_time": "2026-08-06T19:18:40.070000Z",
  "run_context": {
    "code_commit": "14c0d8da1b02d076b3c43a07a34ac96c673018b0",
    "config_version": "lot41-spread-depth-imbalance-config-v1",
    "correlation_id": "microstructure-v4-lot41-reference",
    "run_id": "lot41-reference-run-v1",
    "runtime_mode": "OFFLINE_MICROSTRUCTURE_RESEARCH_ONLY",
    "schema_version": "lot41-run-context-v1"
  },
  "safety": {
    "analysis_only": true,
    "approved_size": 0,
    "execution_allowed": false,
    "external_connectivity_allowed": false,
    "market_event_publication_allowed": false,
    "network_ingestion_allowed": false,
    "order_routing_allowed": false,
    "participant_behavior_inference_explicitly_labeled": true,
    "raw_data_mutation_allowed": false,
    "real_credentials_allowed": false,
    "risk_approval_allowed": false,
    "scenario_score_is_signal": false,
    "signal_generation_allowed": false,
    "trade_allowed": false,
    "used_for_decision": false
  },
  "schema_version": "spread-depth-imbalance-engine-state-v1",
  "validation_state": "VALIDATED_OFFLINE_SPREAD_DEPTH_IMBALANCE_ONLY"
}
